{
  "fromDate": "2021-04-06",
  "toDate": "2021-07-05",
  "ukFhlProperty":{
    "income": {
      "periodAmount": 5000.99,
      "taxDeducted": 3123.21,
      "rentARoom": {
        "rentsReceived": 532.12
      }
    },
    "expenses": {
      "consolidatedExpenses": 988.18
    }
  },
  "ukNonFhlProperty": {
    "income": {
      "premiumsOfLeaseGrant": 42.12,
      "reversePremiums": 84.31,
      "periodAmount": 9884.93,
      "taxDeducted": 842.99,
      "otherIncome": 31.44,
      "rentARoom": {
        "rentsReceived": 947.66
      }
    },
    "expenses": {
      "consolidatedExpenses": 988.18
    }
  }
}
